headline,url
"Hezbollah leader Hassan Nasrallah was killed in Beirut strike, Israel’s military says",https://english.elpais.com/international/2024-09-28/hezbollah-leader-hassan-nasrallah-was-killed-in-beirut-strike-israels-military-says.html
"Georgia: Evangelicals, minority voters and a crowded ballot",https://english.elpais.com/usa/elections/2024-09-28/georgia-evangelicals-minority-voters-and-a-crowded-ballot.html
From the Hermes heir to Nicolas Cage: Millionaires who went bankrupt,https://english.elpais.com/economy-and-business/2024-09-28/from-the-hermes-heir-to-nicolas-cage-millionaires-who-went-bankrupt.html
"The duo who drove Tupperware: A story of success, rivalry and bankruptcy",https://english.elpais.com/economy-and-business/2024-09-28/the-duo-who-drove-tupperware-a-story-of-success-rivalry-and-bankruptcy.html
"Amor Towles, writer: ‘More books have been sold in the US in recent years than ever before, fiction is holding its own’ ",https://english.elpais.com/culture/2024-09-28/amor-towles-writer-more-books-have-been-sold-in-the-us-in-recent-years-than-ever-before-fiction-is-holding-its-own.html
How sex cemented (and stigmatized) the gay community  ,https://english.elpais.com/society/2024-09-28/how-sex-cemented-and-stigmatized-the-gay-community.html
"Daryl Hannah, the actress who has never held back: ‘I’ve been hearing that I’m too old for certain roles since I was 30’ ",https://english.elpais.com/culture/2024-09-28/daryl-hannah-the-actress-who-has-never-held-back-ive-been-hearing-that-im-too-old-for-certain-roles-since-i-was-30.html
Vehicles destroying ancient geoglyphs in the Atacama Desert: ‘The damage is irreversible’,https://english.elpais.com/culture/2024-09-27/vehicles-destroying-ancient-geoglyphs-in-the-atacama-desert-the-damage-is-irreversible.html
Spain lodged formal complaint against Mexico for snub to King Felipe ,https://english.elpais.com/international/2024-09-27/spain-lodged-formal-complaint-against-mexico-for-snub-to-king-felipe.html
Russia considers law to ban defending child-free lifestyle,https://english.elpais.com/international/2024-09-26/russia-considers-law-to-ban-defending-child-free-lifestyle.html
"Angel ‘Monxo’ López, the first Latino curator of the Museum of the City of New York: ‘I don’t want to let my people down’  ",https://english.elpais.com/culture/2024-09-28/angel-monxo-lopez-the-first-latino-curator-of-the-museum-of-the-city-of-new-york-i-dont-want-to-let-my-people-down.html
"The Latino vote in Georgia, Kamala Harris’ key to the White House",https://english.elpais.com/usa/elections/2024-09-26/the-latino-vote-in-georgia-kamala-harris-key-to-the-white-house.html
Posts spread digitally altered photo of Kamala Harris with Sean Combs ,https://english.elpais.com/usa/2024-09-25/posts-spread-digitally-altered-photo-of-kamala-harris-with-sean-combs.html
World leaders commit to action to ensure future of modern medicine  ,https://english.elpais.com/health/2024-09-26/world-leaders-commit-to-action-to-ensure-future-of-modern-medicine.html
Killer whales corner sea lions and hunt dolphins,https://english.elpais.com/science-tech/2024-09-26/previously-unknown-population-of-killer-whales-corner-sea-lions-and-hunt-dolphins-in-northern-chile.html
Spanish border town of Olivenza remains oblivious to Portuguese minister’s claim over it,https://english.elpais.com/international/2024-09-28/spanish-border-town-of-olivenza-remains-oblivious-to-portuguese-ministers-claim-over-it.html
New AI models like ChatGPT can’t be trusted on basic questions,https://english.elpais.com/technology/2024-09-25/new-ai-models-like-chatgpt-pursue-superintelligence-but-cant-be-trusted-even-when-it-comes-to-basic-questions.html
Everything happens for a reason: Why we are fascinated by coincidences,https://english.elpais.com/lifestyle/2024-09-26/everything-happens-for-a-reason-why-we-are-fascinated-by-coincidences.html
Earth is welcoming a temporary mini moon   ,https://english.elpais.com/science-tech/2024-09-27/earth-is-welcoming-a-temporary-mini-moon.html
"Less driving, more cycling: How you commute to work impacts your health",https://english.elpais.com/health/2024-09-24/less-driving-more-cycling-how-you-commute-to-work-impacts-your-health.html
"Tak Mak, immunologist: ‘The immune system is the orchestra for most of life’s symphonies’",https://english.elpais.com/health/2024-09-22/tak-mak-immunologist-the-immune-system-is-the-orchestra-for-most-of-lifes-symphonies.html
Kerstin Noëlle Vokinger: ‘New cancer therapies are being approved for patient groups not included in clinical trials’,https://english.elpais.com/health/2024-09-21/kerstin-noelle-vokinger-new-cancer-therapies-are-being-approved-for-patient-groups-not-included-in-clinical-trials.html
"Lessons from Ireland, the first country to put health warnings on alcohol: ‘Many people drink without being aware of the risk’",https://english.elpais.com/health/2024-09-23/lessons-from-ireland-the-first-country-to-put-health-warnings-on-alcohol-many-people-drink-without-being-aware-of-the-risk.html
Spanish PM Sánchez in New York: ‘Europe needs reforms to avoid falling behind in the most cutting-edge technological sectors’,https://english.elpais.com/economy-and-business/2024-09-24/spanish-pm-sanchez-in-new-york-europe-needs-reforms-to-avoid-falling-behind-in-the-most-cutting-edge-technological-sectors.html
"Inditex, owner of Zara stores, is planning ambitious expansion in the US",https://english.elpais.com/economy-and-business/2024-09-20/inditex-owner-of-zara-stores-is-planning-ambitious-expansion-in-the-us.html
Five keys to understand the Fed’s aggressive interest rate cut,https://english.elpais.com/economy-and-business/2024-09-19/five-keys-to-understand-the-feds-aggressive-interest-rate-cut.html
How the entertainment industry could be missing out on $18 billion by failing to engage Latinos,https://english.elpais.com/economy-and-business/2024-09-17/how-the-entertainment-industry-could-be-missing-out-on-18-billion-by-failing-to-engage-latinos.html
Greek mythology and oversized egos: The Genesis album that ended progressive rock,https://english.elpais.com/culture/2024-09-24/greek-mythology-and-oversized-egos-the-genesis-album-that-ended-progressive-rock.html
Billionaires in a bunker: Tilda Swinton and Michael Shannon’s apocalyptic musical,https://english.elpais.com/culture/2024-09-24/billionaires-in-a-bunker-tilda-swinton-and-michael-shannons-apocalyptic-musical.html
"Cod, pickles and lots of wine: This was the diet on an 18th century ship ",https://english.elpais.com/culture/2024-09-22/cod-pickles-and-lots-of-wine-this-was-the-diet-on-an-18th-century-ship.html
"Peggy Gallagher, the ‘angel’ who fled an abusive husband and got Oasis back on stage",https://english.elpais.com/culture/2024-09-23/peggy-gallagher-the-angel-who-fled-an-abusive-husband-and-got-oasis-back-on-stage.html
"David Nirenberg, historian: ‘If I had to invest in stocks of anything, it would be in xenophobia. It will only rise’",https://english.elpais.com/culture/2024-09-24/david-nirenberg-historian-if-i-had-to-invest-in-stocks-of-anything-it-would-be-in-xenophobia-it-will-only-rise.html
Is our handwriting getting worse? It’s not just technology that affects our way of writing,https://english.elpais.com/lifestyle/2024-09-24/is-our-handwriting-getting-worse-its-not-just-technology-that-affects-our-way-of-writing.html
The redevelopment plan that seeks to give La Rambla back to Barcelona residents,https://english.elpais.com/international/2024-09-21/tourists-also-want-an-authentic-city-not-a-theme-park-the-redevelopment-plan-that-seeks-to-give-la-rambla-back-to-barcelona-residents.html
Sunday syndrome: How to spot the signs that you need a new job ,https://english.elpais.com/lifestyle/2024-09-22/sunday-syndrome-how-to-spot-the-signs-that-you-need-a-new-job.html
What should I do if I can’t stand my best friend’s partner?,https://english.elpais.com/lifestyle/2024-09-20/what-should-i-do-if-i-cant-stand-my-best-friends-partner.html
"Sex, adventure and success: Michael Douglas, the everyman who fulfilled the fantasies of a generation",https://english.elpais.com/culture/2024-09-25/sex-adventure-and-success-michael-douglas-the-everyman-who-fulfilled-the-fantasies-of-a-generation.html
"Eva Mendes, the actress who became a children’s book author: ‘When I had a family, my ambition became about home’",https://english.elpais.com/people/2024-09-23/eva-mendes-the-actress-who-became-a-childrens-book-author-when-i-had-a-family-my-ambition-became-about-home.html
Cryptomnesia: The unconscious plagiarism affecting the music industry ,https://english.elpais.com/culture/2024-09-21/cryptomnesia-the-unconscious-plagiarism-affecting-the-music-industry.html
Thousands of displaced people in Gaza live trapped between bombs and rising tides: ‘We could drown in our sleep’,https://english.elpais.com/international/2024-09-23/thousands-of-displaced-people-in-gaza-live-trapped-between-bombs-and-rising-tides-we-could-drown-in-our-sleep.html
"Psychoanalysis and free sex: The Sullivanians, a commune that mutated into a cult on New York’s Upper West Side",https://english.elpais.com/culture/2024-09-25/psychoanalysis-and-free-sex-the-commune-that-mutated-into-a-cult-on-new-yorks-upper-west-side.html
Tirana Hassan: ‘Sexual violence is so prevalent in Darién that women crossing the border carry the morning-after pill’,https://english.elpais.com/international/2024-09-22/tirana-hassan-sexual-violence-is-so-prevalent-in-darien-that-women-crossing-the-border-carry-the-morning-after-pill.html
Listen now LOS40 USA,https://los40.us/
What is Bad Bunny’s Net Worth in 2024?,https://los40.us/2024/what-is-bad-bunnys-net-worth-in-2024-24882.html
Who is the Artist Behind the Highest Grossing Latin Tour in 2024?,https://los40.us/2024/who-is-the-artist-behind-the-highest-grossing-latin-tour-in-2024-25010.html
EL PAÍS offers free Spanish lessons with Gymglish,https://english.elpais.com/economy-and-business/2021-11-15/el-pais-offers-free-spanish-lessons-with-gymglish.html
Trump erodes trust in election by insisting on the lie that illegal immigrants vote,https://english.elpais.com/usa/elections/2024-09-24/trump-erodes-trust-in-election-by-insisting-that-illegal-immigrants-vote.html
DeSantis’s desperate attempts to torpedo abortion protections at the polls in Florida  ,https://english.elpais.com/usa/elections/2024-09-22/desantiss-desperate-attempts-to-torpedo-abortion-protections-at-the-polls-in-florida.html
"At 17, Nai managed to escape her forced wedding on the very day of the ceremony: The silent revolution of the Maasai of Tanzania  ",https://english.elpais.com/international/2024-09-21/at-17-nai-managed-to-escape-her-forced-wedding-on-the-very-day-of-the-ceremony-the-silent-revolution-of-the-maasai-of-tanzania.html
"A summer away from the bombing of Ukraine, thanks to the Spanish province of Jaén",https://english.elpais.com/international/2024-09-23/russian-companies-desperately-looking-for-staff-but-are-not-paying-enough.html
Cartel war in Sinaloa spreads fear to other states in Mexico: ‘You see fewer people on the streets and businesses close early’,https://english.elpais.com/international/2024-09-24/cartel-war-in-sinaloa-spreads-fear-to-other-states-in-mexico-you-see-fewer-people-on-the-streets-and-businesses-close-early.html
Venezuela kicks off its most uncertain presidential campaign,https://english.elpais.com/international/2024-09-24/more-than-850000-cubans-have-arrived-in-the-us-since-2022-in-the-largest-exodus-in-cuban-history.html
Mrs. Deng is on the hunt for Spain’s last ‘golden visas’,https://english.elpais.com/economy-and-business/2024-09-19/mrs-deng-is-on-the-hunt-for-spains-last-golden-visas.html
An economic paradox: When savings are both a good and a bad idea,https://english.elpais.com/economy-and-business/2024-09-15/artificial-intelligence-will-affect-60-million-us-and-mexican-jobs-within-the-year.html
How a damaged painting hesitatingly attributed to Velázquez could change the art market in Spain,https://english.elpais.com/culture/2024-09-22/how-a-damaged-painting-hesitatingly-attributed-to-velazquez-could-change-the-art-market-in-spain.html
"Cod, pickles and lots of wine: This was the diet on an 18th century ship ",https://english.elpais.com/culture/2024-09-22/cod-pickles-and-lots-of-wine-this-was-the-diet-on-an-18th-century-ship.html
The unknowns surrounding the mysterious rise of cancer in young adults,https://english.elpais.com/health/2024-09-20/the-unknowns-surrounding-the-mysterious-rise-of-cancer-in-young-adults.html
A new map of the endometrium opens the door to possible treatments for endometriosis,https://english.elpais.com/science-tech/2024-09-19/a-new-map-of-the-endometrium-opens-the-door-to-possible-treatments-for-endometriosis.html
"In search of ‘Celebrity Number 6’: How the internet went crazy for Leticia Sardá, a former Spanish model",https://english.elpais.com/culture/2024-09-18/in-search-of-celebrity-number-6-how-the-internet-went-crazy-for-leticia-sarda-a-former-spanish-model.html
The science of Stoicism: Does it really improve mental health?,https://english.elpais.com/health/2024-09-10/the-science-of-stoicism-does-it-really-improve-mental-health.html
An ‘Olympics’ that allows doping? A billionaire’s controversial dream that could change sport forever,https://english.elpais.com/sports/2024-09-18/an-olympics-that-allows-doping-a-billionaires-controversial-dream-that-could-change-sport-forever.html
"Climbing without a rope, between freedom and psychopathy",https://english.elpais.com/sports/2024-09-11/steve-kerr-no-company-in-the-world-would-hire-someone-with-trumps-resume.html
