headline,url
Even Alcatraz isn’t exempt from Trump’s antics,https://english.elpais.com/usa/2025-05-17/even-alcatraz-isnt-exempt-from-trumps-antics.html
‘We just want to be treated like human beings’: Serious abuses reported in El Paso migrant detention center,https://english.elpais.com/usa/2025-05-17/we-just-want-to-be-treated-like-human-beings-serious-abuses-reported-in-el-paso-migrant-detention-center.html
"Nancy Knowlton, marine biologist: ‘Scientists have to speak out against Trump’ ",https://english.elpais.com/science-tech/2025-05-17/nancy-knowlton-marine-biologist-scientists-have-to-speak-out-against-trump.html
The 5% remittance tax threat: A new flashpoint between Mexico and the US,https://english.elpais.com/international/2025-05-17/the-5-remittance-tax-threat-a-new-flashpoint-between-mexico-and-the-us.html
The Nazi past that parents never wanted to talk to their children about,https://english.elpais.com/international/2025-05-17/the-nazi-past-that-parents-never-wanted-to-talk-to-their-children-about.html
Miyawaki in Nezahualcóyotl: The Japanese method of creating forests comes to Mexico,https://english.elpais.com/climate/2025-05-17/miyawaki-in-nezahualcoyotl-the-japanese-method-of-creating-forests-comes-to-mexico.html
"Jane Goodall: ‘The worse it gets, the harder I fight’  ",https://english.elpais.com/science-tech/2025-05-17/jane-goodall-the-worse-it-gets-the-harder-i-fight.html
Pope Leo XIV’s friend and ‘big brother’: “I think he didn’t call himself ‘Francis II’ so as not to upset the conservative cardinals”   ,https://english.elpais.com/international/2025-05-17/pope-leo-xivs-friend-and-big-brother-i-think-he-didnt-call-himself-francis-ii-so-as-not-to-upset-the-conservative-cardinals.html
"Lamine Yamal: ‘I listen to old-school rappers like 50 Cent, Eminem... and some flamenco’",https://english.elpais.com/sports/2025-05-17/lamine-yamal-i-listen-to-old-school-rappers-like-50-cent-eminem-and-some-flamenco.html
The safest and most at-risk states for immigrants: A map of U.S. immigration laws,https://english.elpais.com/usa/2025-05-16/the-safest-and-most-at-risk-states-for-immigrants-a-map-of-us-immigration-laws.html
"Kidnappings, torture, and severed fingers: Attacks on crypto entrepreneurs shake France ",https://english.elpais.com/international/2025-05-16/kidnappings-torture-and-severed-fingers-attacks-on-crypto-entrepreneurs-shake-france.html
Salman Rushdie attacker sentenced to 25 years in prison,https://english.elpais.com/usa/2025-05-16/salman-rushdie-attacker-sentenced-to-25-years-in-prison.html
Judges in Nicaragua now answer to police under Ortega and Murillo’s rule,https://english.elpais.com/international/2025-05-16/judges-in-nicaragua-now-answer-to-police-under-ortega-and-murillos-rule.html
US returns two-year-old girl separated from her deported parents to Venezuela,https://english.elpais.com/usa/2025-05-15/us-returns-two-year-old-girl-separated-from-her-deported-parents-to-venezuela.html
"Firefighters, chefs and psychiatrists: The nepo babies who refused to be famous",https://english.elpais.com/people/2025-05-16/firefighters-chefs-and-psychiatrists-the-nepo-babies-who-refused-to-be-famous.html
"Seven women, one mansion, and $10 million in one month: The inside story of the OnlyFans house",https://english.elpais.com/society/2025-05-15/seven-women-one-mansion-and-10-million-in-one-month-the-inside-story-of-the-onlyfans-house.html
Hervé Kempf: ‘The super-rich like Musk promote a cultural model that is an ecological disaster’,https://english.elpais.com/climate/2025-05-15/herve-kempf-journalist-the-super-rich-like-musk-and-bezos-promote-a-cultural-model-that-represents-an-ecological-disaster.html
‘Menopausal’ at 15?: ‘I was prescribed the pill and then told I’d never get a period’,https://english.elpais.com/health/2025-05-13/menopausal-at-15-i-was-prescribed-the-pill-and-then-told-id-never-get-a-period.html
High blood pressure medication for adults also helps children with butterfly skin,https://english.elpais.com/science-tech/2025-05-12/high-blood-pressure-medication-for-adults-also-helps-children-with-butterfly-skin.html
Trump’s policies freeze key research worldwide: ‘No one fully understands what’s happening’ ,https://english.elpais.com/usa/2025-05-10/trumps-policies-freeze-key-research-worldwide-no-one-fully-understands-whats-happening.html
A Spanish therapy saves the lives of ‘the unluckiest family in the world’,https://english.elpais.com/science-tech/2025-05-07/a-spanish-therapy-saves-the-lives-of-the-unluckiest-family-in-the-world.html
"Justin Yifu Lin, former Chinese government advisor: ‘Trump’s tariff policy is irrational. It will hurt his people’",https://english.elpais.com/economy-and-business/2025-05-15/justin-yifu-lin-former-chinese-government-advisor-trumps-tariff-policy-is-irrational-it-will-hurt-his-people.html
Trump administration introduces new changes to student loans,https://english.elpais.com/usa/2025-05-15/trump-administration-introduces-new-changes-to-student-loans.html
Romania rediscovers its hidden treasure: Minerals,https://english.elpais.com/international/2025-05-05/romania-rediscovers-its-hidden-treasure-minerals.html
Critical minerals: The future lies underground and the fight for control is relentless,https://english.elpais.com/economy-and-business/2025-05-04/critical-minerals-the-future-lies-underground-and-the-fight-for-control-is-relentless.html
"Valencina, the monumental complex led by women 5,000 years ago",https://english.elpais.com/culture/2025-05-13/valencina-the-monumental-complex-led-by-women-5000-years-ago.html
Why is Bella Ramsey the target of so much hate? ‘The Last of Us’ star sparks the fury of the manosphere,https://english.elpais.com/culture/2025-05-12/why-is-bella-ramsey-the-target-of-so-much-hate-the-last-of-us-star-sparks-the-fury-of-the-manosphere.html
The collective experience of translating art for people who are blind,https://english.elpais.com/culture/2025-05-11/the-collective-experience-of-translating-art-for-people-who-are-blind.html
How Pavement was reborn: The 1990s indie band with 200 million Spotify streams,https://english.elpais.com/culture/2025-05-10/how-pavement-was-reborn-the-1990s-indie-band-with-200-million-spotify-streams.html
"‘Horrible, horrible, horrible’: The Gérard Depardieu box office hit that still sparks outrage 50 years later",https://english.elpais.com/culture/2025-05-14/horrible-horrible-horrible-the-gerard-depardieu-box-office-hit-that-still-sparks-outrage-50-years-later.html
"Food Runners, the dating app alternative: Run, eat, meet someone new",https://english.elpais.com/lifestyle/2025-05-12/food-runners-the-dating-app-alternative-run-eat-meet-someone-new.html
"Hollywood’s big lie about disasters: In crises the natural reaction is generosity, not panic",https://english.elpais.com/society/2025-05-06/hollywoods-big-lie-about-disasters-in-crises-like-spains-blackout-the-natural-reaction-is-generosity-not-panic.html
How emos survived their sadness: The ashes of an extinct urban tribe on the verge of resurrection,https://english.elpais.com/culture/2025-05-03/how-emos-survived-their-sadness-the-ashes-of-an-extinct-urban-tribe-on-the-verge-of-resurrection.html
Welcome to the ‘antisocial century’: Are we lonelier now than ever?,https://english.elpais.com/lifestyle/2025-05-03/welcome-to-the-antisocial-century-are-we-lonelier-now-than-ever.html
"14 shows axed: ‘The Equalizer,’ ‘Suits L.A.,’ ‘FBI: Most Wanted,’ and others say farewell",https://english.elpais.com/culture/2025-05-13/14-shows-axed-the-equalizer-suits-la-fbi-most-wanted-and-others-say-farewell.html
"Decoding Glenn Close, the actress who escaped a cult and confronted Hollywood’s sexist clichés",https://english.elpais.com/culture/2025-05-12/decoding-glenn-close-the-actress-who-escaped-a-cult-and-confronted-hollywoods-sexist-cliches.html
"Sarah Paulson: ‘For many, the age difference with my wife [who is 31 years older] is very disconcerting’",https://english.elpais.com/culture/2025-05-11/sarah-paulson-for-many-the-age-difference-with-my-wife-who-is-31-years-older-is-very-disconcerting.html
"Who is Jami Gertz, the unknown actress who is the richest woman in Hollywood?",https://english.elpais.com/culture/2025-05-10/who-is-jami-gertz-the-unknown-actress-who-is-the-richest-woman-in-hollywood.html
Zara in the age of Marta Ortega ,https://english.elpais.com/eps/2025-05-11/zara-in-the-age-of-marta-ortega.html
The abandoned homes of Venezuelan migrants,https://english.elpais.com/international/2025-05-11/the-abandoned-homes-of-venezuelan-migrants.html
The library with one door in Canada and the other one (now closing) in the US,https://english.elpais.com/culture/2025-05-11/the-library-with-one-door-in-canada-and-the-other-one-now-closing-in-the-us.html
Trump’s extortion of Latin America: What the Republican has extracted through threats,https://english.elpais.com/usa/2025-05-12/trumps-extortion-of-latin-america-what-the-republican-has-achieved-through-threats.html
Listen now LOS40 USA,https://los40.us/
Los Ángeles Azules Victims of Armed Robbery After Concert,https://los40.us/2025/los-angeles-azules-victims-of-armed-robbery-after-concert-33739.html
"Shakira Kicks Off ‘Las Mujeres Ya No Lloran’ USA Tour: Dates, Cities, Tickets, Setlist…",https://los40.us/2025/shakira-kicks-off-las-mujeres-ya-no-lloran-usa-tour-dates-cities-tickets-setlist-33787.html
EL PAÍS offers free Spanish lessons with Gymglish,https://english.elpais.com/economy-and-business/2021-11-15/el-pais-offers-free-spanish-lessons-with-gymglish.html
"Pride, defiance and jubilation among Trump supporters at rally to mark his first 100 days in office ",https://english.elpais.com/usa/2025-04-30/pride-defiance-and-jubilation-among-trump-supporters-at-rally-to-mark-his-first-100-days-in-office.html
The US targets La Familia Michoacana in its crusade against fentanyl,https://english.elpais.com/usa/2025-04-16/the-us-targets-la-familia-michoacana-in-its-crusade-against-fentanyl.html
Chancellor Merz’s international challenge: Make Germany ‘independent’ from the US or maintain the link despite Trump,https://english.elpais.com/international/2025-05-06/chancellor-merzs-international-challenge-make-germany-independent-from-the-us-or-maintain-the-link-despite-trump.html
Israel deals yet another blow to Gaza’s decimated healthcare system,https://english.elpais.com/international/2025-04-15/israel-deals-yet-another-blow-to-gazas-decimated-healthcare-system.html
The Trump effect and the mistakes of Correismo hand Daniel Noboa victory in Ecuador,https://english.elpais.com/international/2025-04-15/the-trump-effect-and-the-mistakes-of-correismo-hand-daniel-noboa-victory-in-ecuador.html
Venezuela kicks off its most uncertain presidential campaign,https://english.elpais.com/international/2025-04-14/don-neto-and-the-sinaloa-old-guard-who-reinvented-drug-trafficking-in-guadalajara.html
Living like a nobleman: The highly profitable trend of restoring historic buildings,https://english.elpais.com/economy-and-business/2025-04-26/living-like-a-nobleman-the-highly-profitable-trend-of-restoring-historic-buildings.html
An economic paradox: When savings are both a good and a bad idea,https://english.elpais.com/economy-and-business/2025-04-10/a-financial-crisis-in-the-age-of-misinformation-more-market-volatility-and-greater-liquidity-risks.html
Jason Isaacs: The villain who managed to dodge fame until ‘The White Lotus’,https://english.elpais.com/people/2025-04-12/jason-isaacs-the-villain-who-managed-to-dodge-fame-until-the-white-lotus.html
Jon Hamm: ‘I don’t think very much about Don Draper’,https://english.elpais.com/culture/2025-04-11/jon-hamm-i-dont-think-very-much-about-don-draper.html
Using brain-dead people for medical experiments: The new debate at the frontier of bioethics,https://english.elpais.com/science-tech/2025-05-02/using-brain-dead-people-for-medical-experiments-the-new-debate-at-the-frontier-of-bioethics.html
Mapping a tiny piece of mouse brain opens up new path to understanding human intelligence,https://english.elpais.com/science-tech/2025-04-09/mapping-a-tiny-piece-of-mouse-brain-opens-up-new-path-to-understanding-human-intelligence.html
Welcome to the ‘antisocial century’: Are we lonelier now than ever?,https://english.elpais.com/lifestyle/2025-05-03/welcome-to-the-antisocial-century-are-we-lonelier-now-than-ever.html
"Different ideal, same pressure: Gen Z’s fixation on ‘perfect’ skin echoes millennials’ obsession on being thin",https://english.elpais.com/lifestyle/2025-03-15/different-ideal-same-pressure-gen-zs-fixation-on-perfect-skin-echoes-millennials-obsession-on-being-thin.html
Canadians put their elbows up: Hockey becomes a symbol of resistance against Trump,https://english.elpais.com/international/2025-04-07/canadians-put-their-elbows-up-hockey-becomes-a-symbol-of-resistance-against-trump.html
"Climbing without a rope, between freedom and psychopathy",https://english.elpais.com/sports/2025-03-11/could-maradonas-death-have-been-avoided-trial-of-soccer-stars-carers-begins-in-buenos-aires.html
